<?xml version="1.0" encoding="UTF-8"?>
<!--
Copyright (c) 2002 W3C(r) (http://www.w3.org/) (MIT (http://www.lcs.mit.edu/),
INRIA (http://www.inria.fr/), Keio (http://www.keio.ac.jp/)),
All Rights Reserved.
See http://www.w3.org/Consortium/Legal/ipr-notice-20000612#Copyright.
W3C liability
(http://www.w3.org/Consortium/Legal/ipr-notice-20000612#Legal_Disclaimer),
trademark
(http://www.w3.org/Consortium/Legal/ipr-notice-20000612#W3C_Trademarks),
document use
(http://www.w3.org/Consortium/Legal/copyright-documents-19990405),
and software licensing rules
(http://www.w3.org/Consortium/Legal/copyright-software-19980720)
apply.
-->
<!DOCTYPE g:grammar SYSTEM "grammar.dtd">

<g:grammar xmlns:g="http://www.w3.org/2001/03/XPath/grammar">
  <!-- ====================== Meta Information ==================== -->
  <!-- SJB grammar2spec.xsl seems to pick the first of these to create anchor names -->
  <g:language id="xpath1" display-name="XPath 1.0" if="xpath1"/>
  <g:language id="xpath20" display-name="XPath 2.0" if="xpath20"/>
  <g:language id="xpath30" display-name="XPath 3.0" if="xpath30"/>
  <g:language id="xpath31" display-name="XPath 3.1" if="xpath31"/>
  <g:language id="xquery10" display-name="XQuery 1.0" if="xquery10"/>
  <g:language id="xquery30" display-name="XQuery 3.0" if="xquery30"/>
  <g:language id="xquery31" display-name="XQuery 3.1" if="xquery31"/>
  <g:language id="xcore" display-name="XML Processing Formal Semantics Core Language 1.0" if="xcore"/>
  <g:language id="xslt2-patterns" display-name="XSLT 2.0 Patterns" if="xslt2-patterns"/>
  <g:language id="xslt30-patterns" display-name="XSLT 3.0 Patterns" if="xslt30-patterns"/>
  <!-- extensions: -->
  <g:language id="fulltext" display-name="XQuery Full-Text 1.0" if="fulltext"/>
  <g:language id="scripting" display-name="XQuery Scripting Extension 1.0" if="scripting"/>
  <g:language id="update10" display-name="XQuery Update Facility 1.0" if="update10"/>
  <g:language id="update30" display-name="XQuery Update Facility 3.0" if="update30"/>

  <!-- ====================== Entry Point Information ==================== -->
  <g:start name="ExprSingle" state="DEFAULT" if="xpath1"/>
  <g:start name="XPath" state="DEFAULT" if="xpath20 xpath30 xpath31"/>
  <g:start name="Expr" state="DEFAULT" if="xcore"/>
  <g:start name="QueryList" state="DEFAULT" if="xquery10 xquery30 xquery31"/>
  <g:start name="Pattern" state="DEFAULT" if="xslt2-patterns"/>
  <g:start name="Pattern30" state="DEFAULT" if="xslt30-patterns"/>

  <!-- ====================== Grammar Productions ==================== -->

  <!-- [ start XSLT 2.0 Patterns -->

  <g:production name="Pattern" if="xslt2-patterns">
    <g:ref name="PathPattern"/>
    <g:optional name="PathPatternTail">
      <g:string>|</g:string>
      <g:ref name="Pattern"/>
    </g:optional>
  </g:production>

  <g:production name="PathPattern" if="xslt2-patterns" xgc-id="leading-lone-slash">
    <g:choice break="true" name="PathPatternChoices">
      <g:sequence>
        <g:ref name="Slash"/>
        <g:optional name="OptionalRelativePathPattern" lookahead="1">
          <g:ref name="RelativePathPattern"/>
        </g:optional>
      </g:sequence>
      <g:sequence>
        <g:ref name="SlashSlash"/>
        <g:ref name="RelativePathPattern"/>
      </g:sequence>
      <g:sequence lookahead="2">
        <g:ref name="IdKeyPattern"/>
        <g:optional>
          <g:choice>
            <g:ref name="Slash" node-type="void"/>
            <g:ref name="SlashSlash"/>
          </g:choice>
          <g:ref name="RelativePathPattern"/>
        </g:optional>
      </g:sequence>
      <g:ref name="RelativePathPattern"/>
    </g:choice>
  </g:production>

  <g:production name="RelativePathPattern" if="xslt2-patterns" node-type="void">
    <g:ref name="PatternStep"/>
    <g:optional name="RelativePathPatternTail">
      <g:choice name="PatternStepSep">
        <g:ref name="Slash" node-type="void"/>
        <g:ref name="SlashSlash"/>
      </g:choice>
      <g:ref name="RelativePathPattern"/>
    </g:optional>
  </g:production>

  <g:production name="PatternStep" if="xslt2-patterns">
    <g:optional name="OptionalPatternAxis" lookahead="2">
      <g:ref name="PatternAxis"/>
    </g:optional>
    <g:ref name="NodeTest"/>
    <g:ref name="PredicateList"/>
  </g:production>

  <g:production name="PatternAxis" if="xslt2-patterns">
    <g:choice break="true" name="AxisChoice">
      <g:sequence>
        <g:string process-value="yes">child</g:string>
        <g:string>::</g:string>
      </g:sequence>
      <g:sequence>
        <g:string process-value="yes">attribute</g:string>
        <g:string>::</g:string>
      </g:sequence>
      <g:string>@</g:string>
    </g:choice>
  </g:production>

  <g:production name="IdKeyPattern" if="xslt2-patterns">
    <g:choice name="KeyOrIDPattern">
      <g:sequence>
        <g:string process-value="yes">id</g:string>
        <g:string>(</g:string>
        <g:ref name="IdValue"/>
        <g:string>)</g:string>
      </g:sequence>
      <g:sequence>
        <g:string process-value="yes">key</g:string>
        <g:string>(</g:string>
        <g:ref name="StringLiteral"/>
        <g:string>,</g:string>
        <g:ref name="KeyValue"/>
        <g:string>)</g:string>
      </g:sequence>
    </g:choice>
  </g:production>

  <g:production name="IdValue" node-type="void" if="xslt2-patterns">
    <g:choice>
      <g:ref name="StringLiteral"/>
      <g:ref name="VarRef"/>
    </g:choice>
  </g:production>

  <g:production name="KeyValue" node-type="void" if="xslt2-patterns">
    <g:choice>
      <g:ref name="Literal"/>
      <g:ref name="VarRef"/>
    </g:choice>
  </g:production>

  <!-- ] end XSLT 2.0 Patterns -->
  
  <!-- [ start XSLT 3.0 Patterns -->
  
  <g:production name="Pattern30" if="xslt30-patterns">
    <g:choice name="Pattern30Choices">
      <g:ref name="PredicatePattern"/>
      <g:ref name="UnionExprP"/>
    </g:choice> 
  </g:production>
  
  <g:production name="PredicatePattern" if="xslt30-patterns">
    <g:string>.</g:string>
    <g:ref name="PredicateList"/>
  </g:production>
  
  <g:production name="UnionExprP" if="xslt30-patterns">
    <g:ref name="IntersectExceptExprP"/>
    <g:zeroOrMore name="UnionExprPTail">
      <g:choice name="UnionExprPOperator">
        <g:string>union</g:string>
        <g:string>|</g:string>
      </g:choice>
      <g:ref name="IntersectExceptExprP"/>
    </g:zeroOrMore>
  </g:production>
  
  <g:production name="IntersectExceptExprP" if="xslt30-patterns">
    <g:ref name="PathExprP"/>
    <g:zeroOrMore name="IntersectExceptExprPTail">
      <g:choice name="IntersectExceptExprPOperator">
        <g:string>intersect</g:string>
        <g:string>except</g:string>
      </g:choice>
      <g:ref name="PathExprP"/>
    </g:zeroOrMore>
  </g:production>
  
  <g:production name="PathExprP" if="xslt30-patterns" xgc-id="leading-lone-slash">
    <g:choice break="true" name="PathExprPChoices">
      <g:ref name="RootedPath" lookahead="2"/>
      <g:sequence>
        <g:ref name="Slash"/>
        <g:optional name="OptionalRelativePathExprP" lookahead="1">
          <g:ref name="RelativePathExprP"/>
        </g:optional>
      </g:sequence>
      <g:sequence>
        <g:ref name="SlashSlash"/>
        <g:ref name="RelativePathExprP"/>
      </g:sequence>
      <g:ref name="RelativePathExprP"/>
    </g:choice>
  </g:production>
  
  <g:production name="RootedPath" if="xslt30-patterns">
    <g:choice name="VarOrFunctionCall">
      <g:ref name="VarRef"/>
      <g:ref name="FunctionCallP"/>
    </g:choice>
    <g:ref name="PredicateList"/>
    <g:optional>
      <g:choice name="RootedPathOperator">
        <g:ref name="Slash"/>
        <g:ref name="SlashSlash"/>
      </g:choice>
      <g:ref name="RelativePathExprP"/>
    </g:optional>
  </g:production>
  
  <g:production name="FunctionCallP" if="xslt30-patterns">
    <g:ref name="OuterFunctionName"/>
    <g:ref name="ArgumentListP"/>
  </g:production>
  
  <g:production name="OuterFunctionName" if="xslt30-patterns">
    <g:choice name="FNameChoice">
      <g:string process-value="yes">doc</g:string>
      <g:string process-value="yes">id</g:string>
      <g:string process-value="yes">element-with-id</g:string>
      <g:string process-value="yes">key</g:string>
      <g:ref name="URIQualifiedName"/>
    </g:choice>
  </g:production>

  <g:production name="ArgumentListP" if="xslt30-patterns">
    <g:string>(</g:string>
    <g:optional name="ArgListP">
      <g:ref name="ArgumentP"/>
      <g:zeroOrMore name="ArgListTailP">
        <g:string>,</g:string>
        <g:ref name="ArgumentP"/>
      </g:zeroOrMore>
    </g:optional>
    <g:string>)</g:string>
  </g:production>
  
  <g:production name="ArgumentP" if="xslt30-patterns">
    <g:choice name="ArgumentPChoice">
      <g:ref name="VarRef"/>
      <g:ref name="Literal"/>
    </g:choice>
  </g:production>
     
  <g:production name="RelativePathExprP" if="xslt30-patterns" node-type="void">
    <g:ref name="StepExprP"/>
    <g:zeroOrMore name="RelativePathExprPTail">
      <g:choice name="RelativePathExprPOperator">
        <g:ref name="Slash" node-type="void"/>
        <g:ref name="SlashSlash"/>
      </g:choice>
      <g:ref name="StepExprP"/>
    </g:zeroOrMore>
  </g:production>
  
  <g:production name="StepExprP" if="xslt30-patterns" >
    <g:choice name="StepExprPChoice">
      <g:ref name="PostfixExprP"/>
      <g:ref name="AxisStepP"/>
    </g:choice>
  </g:production>
  
  <g:production name="PostfixExprP" if="xslt30-patterns" >
    <g:ref name="ParenthesizedExprP"/>
    <g:ref name="PredicateList"/>
  </g:production>
  
  <g:production name="ParenthesizedExprP" if="xslt30-patterns" >
    <g:string>(</g:string>
    <g:ref name="UnionExprP"/>
    <g:string>)</g:string>
  </g:production>
  
  <g:production name="AxisStepP" if="xslt30-patterns" >
    <g:ref name="ForwardStepP"/>
    <g:ref name="PredicateList"/>
  </g:production>